{
  "site_id": "my-studio",
  "output_folder": "Results/My-StudioWebsite",
  "theme": {
    "page_bg": "#ffffff",
    "surface": "#ffffff",
    "surface_strong": "#f6f8fc",
    "text_primary": "#1c1e2e",
    "text_secondary": "#4c527d",
    "accent": "#3296ed",
    "line": "#dfe3f1",
    "widget_gradient": "linear-gradient(to bottom, #f0f6fa, #f0f6fa)",
    "cover_background": "#3296ed",
    "intro_gradient": "linear-gradient(to bottom, #f6f8fc 0, #ffffff 70%)",
    "catalog_gradient": "linear-gradient(to bottom, #f6f8fc 0, #ffffff 70%)",
    "offers_gradient": "linear-gradient(to bottom, #ffffff 0, #f6f8fc 70%)",
    "photos_gradient": "linear-gradient(to bottom, #f6f8fc 0, #ffffff 70%)",
    "vacancies_gradient": "linear-gradient(to bottom, #ffffff 0, #f6f8fc 70%)",
    "follow_us_gradient": "linear-gradient(to bottom, #f6f8fc 0, #ffffff 70%)",
    "footer_gradient": "linear-gradient(to bottom, #f6f8fc 0, #ffffff 85%)"
  },
  "store_icons": {
    "google_play": "assets/gp-store-icon.png",
    "app_store": "assets/appstore-store-icon.png",
    "galaxy": "assets/galaxy-store-icon.png",
    "amazon": "assets/amazon-store-icon.png"
  },
  "subscribe_block": {
    "title": "Subscribe for news",
    "links": []
  },
  "social": {
    "github_url": "https://github.com/orgs/My-Studio-Developer/repositories",
    "linkedin_url": "https://www.linkedin.com/company/my-studiogames/?originalSubdomain=cy",
    "facebook_url": "https://www.facebook.com/p/My-StudioGames-100057502747171/"
  },
  "header": {
    "brand": {
      "logo": "assets/logo-3.png",
      "text": ""
    },
    "nav": [
      { "label": "Company", "href": "#intro_title", "open_in_new_tab": false },
      { "label": "Our Games", "href": "#apps", "open_in_new_tab": false },
      { "label": "Why join us", "href": "#offers", "open_in_new_tab": false },
      { "label": "Careers", "href": "#vacancies", "open_in_new_tab": false },
      { "label": "Contacts", "href": "#contact", "open_in_new_tab": false }
    ]
  },
  "footer": {
    "enabled": true,
    "section_title": "Contacts",
    "contact": {
      "paragraphs": ["Gr.Xenopoulou 17, 3106, Limassol, Cyprus"],
      "email": "support@my-studiodevs.com"
    },
    "privacy_url": "https://my-studio.games/privacy-aoc.html",
    "privacy_label": "Privacy Policy",
    "terms_url": "",
    "terms_label": "Terms of Service",
    "copyright": "© 2019–2026 Yadarko Trading Ltd",
    "cookie_notice": "This website does not use cookies"
  },
  "widgets": {}
}
